{
  "protocol": 1,
  "kind": "result",
  "id": "msg_01HZRES00000000000000001",
  "ts": 1726640000150,
  "commandId": "cmd_01HZIDEMPOTENT000000001",
  "sessionId": "s_01HZSESSION00000000000001",
  "type": "command.result",
  "payload": {
    "state": "completed",
    "data": {
      "success": true
    }
  }
}